[
  {
    "id": "S001",
    "url": "https://eur-lex.europa.eu/eli/reg/2024/1689/oj",
    "url_canonical": "eur-lex.europa.eu/eli/reg/2024/1689/oj",
    "url_punycode": "eur-lex.europa.eu/eli/reg/2024/1689/oj",
    "title": "Regulation (EU) 2024/1689 of the European Parliament and of the Council (Artificial Intelligence Act)",
    "publisher": "Official Journal of the European Union",
    "author": null,
    "published_date": "2024-07-12",
    "accessed_date": "2026-04-17",
    "domain_tier": 1,
    "admiralty_reliability": "A",
    "tavily_score": 0.94,
    "retrieval_tool": "tavily_search",
    "retrieval_query": "EU AI Act GPAI provisions 2026 official journal",
    "sub_questions": ["sq1", "sq2"],
    "primary_source": true,
    "notes": ""
  },
  {
    "id": "S002",
    "url": "https://digital-strategy.ec.europa.eu/en/policies/gpai-guidance",
    "url_canonical": "digital-strategy.ec.europa.eu/en/policies/gpai-guidance",
    "url_punycode": "digital-strategy.ec.europa.eu/en/policies/gpai-guidance",
    "title": "GPAI guidance — Articles 53–55 application",
    "publisher": "European AI Office",
    "author": null,
    "published_date": "2025-07-18",
    "accessed_date": "2026-04-17",
    "domain_tier": 1,
    "admiralty_reliability": "A",
    "tavily_score": 0.91,
    "retrieval_tool": "tavily_search",
    "retrieval_query": "GPAI provisions 2026 European AI Office guidance",
    "sub_questions": ["sq1"],
    "primary_source": true,
    "notes": ""
  },
  {
    "id": "S003",
    "url": "https://ec.europa.eu/info/law/article-2-5g-note",
    "url_canonical": "ec.europa.eu/info/law/article-2-5g-note",
    "url_punycode": "ec.europa.eu/info/law/article-2-5g-note",
    "title": "Article 2(5g) open-source definition note",
    "publisher": "European Commission",
    "author": null,
    "published_date": "2025-06-02",
    "accessed_date": "2026-04-17",
    "domain_tier": 1,
    "admiralty_reliability": "A",
    "tavily_score": 0.88,
    "retrieval_tool": "tavily_search",
    "retrieval_query": "EU AI Act open-source exemption Article 2 5g definition",
    "sub_questions": ["sq2"],
    "primary_source": true,
    "notes": ""
  },
  {
    "id": "S004",
    "url": "https://eur-lex.europa.eu/legal-content/EN/TXT/53-55-consolidated",
    "url_canonical": "eur-lex.europa.eu/legal-content/en/txt/53-55-consolidated",
    "url_punycode": "eur-lex.europa.eu/legal-content/EN/TXT/53-55-consolidated",
    "title": "Consolidated text of Articles 53–55 with recitals",
    "publisher": "Eur-Lex",
    "author": null,
    "published_date": "2025-01-15",
    "accessed_date": "2026-04-17",
    "domain_tier": 1,
    "admiralty_reliability": "A",
    "tavily_score": null,
    "retrieval_tool": "tavily_extract",
    "retrieval_query": "EU AI Act Articles 53 54 55 consolidated text",
    "sub_questions": ["sq1"],
    "primary_source": true,
    "notes": "Retrieved via tavily_extract (no relevance score returned by this tool). Admitted through the Phase-2 battery as Tier 1 primary consolidation of S001."
  },
  {
    "id": "S005",
    "url": "https://digital-strategy.ec.europa.eu/en/policies/code-of-practice-gpai",
    "url_canonical": "digital-strategy.ec.europa.eu/en/policies/code-of-practice-gpai",
    "url_punycode": "digital-strategy.ec.europa.eu/en/policies/code-of-practice-gpai",
    "title": "Code of Practice for GPAI providers",
    "publisher": "European AI Office",
    "author": null,
    "published_date": "2025-07-10",
    "accessed_date": "2026-04-17",
    "domain_tier": 1,
    "admiralty_reliability": "A",
    "tavily_score": 0.92,
    "retrieval_tool": "tavily_search",
    "retrieval_query": "EU AI Office Code of Practice GPAI transparency 2025",
    "sub_questions": ["sq1", "sq5"],
    "primary_source": true,
    "notes": ""
  },
  {
    "id": "S006",
    "url": "https://ai.meta.com/blog/llama-eu-ai-act-article-2-5g",
    "url_canonical": "ai.meta.com/blog/llama-eu-ai-act-article-2-5g",
    "url_punycode": "ai.meta.com/blog/llama-eu-ai-act-article-2-5g",
    "title": "Llama and the EU AI Act open-source exemption",
    "publisher": "Meta AI",
    "author": "Meta AI policy team",
    "published_date": "2025-08-05",
    "accessed_date": "2026-04-17",
    "domain_tier": 2,
    "admiralty_reliability": "B",
    "tavily_score": 0.82,
    "retrieval_tool": "tavily_search",
    "retrieval_query": "Meta Llama EU AI Act open source exemption response",
    "sub_questions": ["sq3"],
    "primary_source": false,
    "notes": ""
  },
  {
    "id": "S007",
    "url": "https://huggingface.co/blog/eu-ai-act-model-cards",
    "url_canonical": "huggingface.co/blog/eu-ai-act-model-cards",
    "url_punycode": "huggingface.co/blog/eu-ai-act-model-cards",
    "title": "Model-card template aligned to the Code of Practice",
    "publisher": "Hugging Face",
    "author": "Hugging Face policy team",
    "published_date": "2025-09-02",
    "accessed_date": "2026-04-17",
    "domain_tier": 2,
    "admiralty_reliability": "B",
    "tavily_score": 0.8,
    "retrieval_tool": "tavily_search",
    "retrieval_query": "HuggingFace EU AI Act model card template Code of Practice",
    "sub_questions": ["sq3"],
    "primary_source": false,
    "notes": ""
  },
  {
    "id": "S008",
    "url": "https://mistral.ai/news/eu-ai-act-alignment",
    "url_canonical": "mistral.ai/news/eu-ai-act-alignment",
    "url_punycode": "mistral.ai/news/eu-ai-act-alignment",
    "title": "European regulatory alignment statement",
    "publisher": "Mistral AI",
    "author": null,
    "published_date": "2025-09-14",
    "accessed_date": "2026-04-17",
    "domain_tier": 2,
    "admiralty_reliability": "B",
    "tavily_score": 0.78,
    "retrieval_tool": "tavily_search",
    "retrieval_query": "Mistral EU AI Act compliance alignment 2025",
    "sub_questions": ["sq3"],
    "primary_source": false,
    "notes": ""
  },
  {
    "id": "S009",
    "url": "https://foundation.mozilla.org/blog/eu-ai-act-open-source-critique",
    "url_canonical": "foundation.mozilla.org/blog/eu-ai-act-open-source-critique",
    "url_punycode": "foundation.mozilla.org/blog/eu-ai-act-open-source-critique",
    "title": "The open-source exemption will not protect what it purports to",
    "publisher": "Mozilla Foundation",
    "author": "Mozilla Foundation policy team",
    "published_date": "2025-10-03",
    "accessed_date": "2026-04-17",
    "domain_tier": 2,
    "admiralty_reliability": "B",
    "tavily_score": 0.83,
    "retrieval_tool": "tavily_search",
    "retrieval_query": "Mozilla EU AI Act open source exemption critique",
    "sub_questions": ["sq4"],
    "primary_source": false,
    "notes": ""
  },
  {
    "id": "S010",
    "url": "https://reuters.com/technology/eu-ai-act-gpai-effect-2025-08-02",
    "url_canonical": "reuters.com/technology/eu-ai-act-gpai-effect-2025-08-02",
    "url_punycode": "reuters.com/technology/eu-ai-act-gpai-effect-2025-08-02",
    "title": "EU AI Act takes effect for foundation models",
    "publisher": "Reuters",
    "author": "Reuters staff",
    "published_date": "2025-08-02",
    "accessed_date": "2026-04-17",
    "domain_tier": 2,
    "admiralty_reliability": "B",
    "tavily_score": 0.87,
    "retrieval_tool": "tavily_search",
    "retrieval_query": "EU AI Act effective date foundation models August 2025",
    "sub_questions": ["sq1", "sq3"],
    "primary_source": false,
    "notes": ""
  },
  {
    "id": "S011",
    "url": "https://ft.com/content/ai-office-q3-2026-clarifications",
    "url_canonical": "ft.com/content/ai-office-q3-2026-clarifications",
    "url_punycode": "ft.com/content/ai-office-q3-2026-clarifications",
    "title": "AI Office previews Q3 2026 clarifications on training-data summaries",
    "publisher": "Financial Times",
    "author": "FT tech policy desk",
    "published_date": "2026-03-11",
    "accessed_date": "2026-04-17",
    "domain_tier": 2,
    "admiralty_reliability": "B",
    "tavily_score": 0.84,
    "retrieval_tool": "tavily_search",
    "retrieval_query": "EU AI Office Q3 2026 training data summary clarifications",
    "sub_questions": ["sq1", "sq4"],
    "primary_source": false,
    "notes": ""
  },
  {
    "id": "S012",
    "url": "https://techcrunch.com/2026/02/18/small-open-source-ai-eu-compliance-costs",
    "url_canonical": "techcrunch.com/2026/02/18/small-open-source-ai-eu-compliance-costs",
    "url_punycode": "techcrunch.com/2026/02/18/small-open-source-ai-eu-compliance-costs",
    "title": "Small open-source AI providers say EU compliance costs exceed €1M",
    "publisher": "TechCrunch",
    "author": "TechCrunch staff",
    "published_date": "2026-02-18",
    "accessed_date": "2026-04-17",
    "domain_tier": 3,
    "admiralty_reliability": "C",
    "tavily_score": 0.74,
    "retrieval_tool": "tavily_search",
    "retrieval_query": "open source AI provider EU compliance cost estimate 2026",
    "sub_questions": ["sq4"],
    "primary_source": false,
    "notes": "Single trade-press source; claim not corroborated by Tier 1/2 regulatory or independent analyst material. Supporting claim moved to Needs Verification."
  },
  {
    "id": "S013",
    "url": "https://europarl.europa.eu/RegData/etudes/BRIE/2026/ai-act-enforcement",
    "url_canonical": "europarl.europa.eu/regdata/etudes/brie/2026/ai-act-enforcement",
    "url_punycode": "europarl.europa.eu/RegData/etudes/BRIE/2026/ai-act-enforcement",
    "title": "AI Act enforcement: state of play, February 2026",
    "publisher": "European Parliamentary Research Service",
    "author": "EPRS STOA unit",
    "published_date": "2026-02-10",
    "accessed_date": "2026-04-17",
    "domain_tier": 1,
    "admiralty_reliability": "A",
    "tavily_score": 0.85,
    "retrieval_tool": "tavily_search",
    "retrieval_query": "AI Act GPAI enforcement actions guidance letters 2026",
    "sub_questions": ["sq5"],
    "primary_source": true,
    "notes": ""
  },
  {
    "id": "S014",
    "url": "https://oecd.org/digital/ai/open-source-regulatory-note",